<?xml version="1.0" encoding="UTF-8"?>
<obavestenje:Obavestenje xmlns:obavestenje="http://ftn.uns.ac.rs/xml_obavestenja"
 xmlns:opste="http://ftn.uns.ac.rs/xml_opste"
 xmlns:xsi="http://www.w3.org/2001/XMLSchema-instance"
 xsi:schemaLocation="http://ftn.uns.ac.rs/xml_obavestenja file:/C:/Users/Zdravko/Documents/Lab/fax/XMLProjekat/doc/schema/obavestenje.xsd">
    <obavestenje:Datum>
        <opste:Dan>---01</opste:Dan>
        <opste:Mesec>--01</opste:Mesec>
        <opste:Godina>2006</opste:Godina>
    </obavestenje:Datum>
    <obavestenje:Organ>
        <opste:Naziv>
        </opste:Naziv>
        <opste:Adresa>
            <opste:Ulica>Ulica0</opste:Ulica>
            <opste:Broj>50</opste:Broj>
            <opste:Postanski_broj>50</opste:Postanski_broj>
            <opste:Mesto>Mesto0</opste:Mesto>
            <opste:Drzava>Drzava0</opste:Drzava>
        </opste:Adresa>
    </obavestenje:Organ>
    <obavestenje:Podaci_podnosioca>
        <obavestenje:Naziv>Naziv0</obavestenje:Naziv>
        <obavestenje:Adresa>
            <opste:Ulica>Ulica1</opste:Ulica>
            <opste:Broj>50</opste:Broj>
            <opste:Postanski_broj>50</opste:Postanski_broj>
            <opste:Mesto>Mesto1</opste:Mesto>
            <opste:Drzava>Drzava1</opste:Drzava>
        </obavestenje:Adresa>
    </obavestenje:Podaci_podnosioca>
    <obavestenje:Telo_obavestenja>
        <obavestenje:Zakon>Zakon0</obavestenje:Zakon>
        <obavestenje:Godina>2006</obavestenje:Godina>
        <obavestenje:Dan>---01</obavestenje:Dan>
        <obavestenje:Vreme>01:01:01.001</obavestenje:Vreme>
        <obavestenje:Adresa>
            <opste:Ulica>Ulica2</opste:Ulica>
            <opste:Broj>50</opste:Broj>
            <opste:Postanski_broj>50</opste:Postanski_broj>
            <opste:Mesto>Mesto2</opste:Mesto>
            <opste:Drzava>Drzava2</opste:Drzava>
        </obavestenje:Adresa>
        <obavestenje:Kancelarija>50</obavestenje:Kancelarija>
        <obavestenje:Suma>0</obavestenje:Suma>
    </obavestenje:Telo_obavestenja>
    <obavestenje:Dostavljeno/>
</obavestenje:Obavestenje>
